row_ref,field_key,issue_type,severity,details,original,suggestion,human_decision,notes
ROW:2|KEY:Details_of_new_customer_account_the_entity,Details_of_new_customer_account_the_entity,Jargon,Medium,Contains: entity,"Details of new customer account (""the entity"")	","Details of new customer account (""the company"")	",,
ROW:2|KEY:GENname,GENname,Jargon,Medium,Contains: entity,Name of fund (CIS) entity (in full),Name of fund (CIS) company (in full),,
ROW:2|KEY:GENcorplisted,GENcorplisted,Jargon,Medium,Contains: entity,Is this entity listed on a stock exchange?,Is this company listed on a stock exchange?,,
ROW:2|KEY:GENlistedmarket,GENlistedmarket,Jargon,Medium,Contains: entity,Please confirm which market the entity is listed on,Please confirm which market the company is listed on,,
ROW:2|KEY:GENCountryRegisteredAndJurisdictionSame,GENCountryRegisteredAndJurisdictionSame,Jargon,Medium,Contains: jurisdiction,Is the Country of registration/formation the same as the Jurisdiction in which you are opening the account?,Is the Country of registration/formation the same as the country or region in which you are opening the account?,,
ROW:2|KEY:GENCountryRegistrationJurisdictionMismatchRationale,GENCountryRegistrationJurisdictionMismatchRationale,Jargon,Medium,Contains: jurisdiction,The country of Registration/Formation selected does not match the jurisdiction where you are applying for an account to be opened. Please provide rationale justifying why an account is required in this jurisdiction:,The country of Registration/Formation selected does not match the country or region where you are applying for an account to be opened. Please provide rationale justifying why an account is required in this country or region:,,
ROW:2|KEY:GENentitytype,GENentitytype,Jargon,Medium,Contains: entity,Entity Type,company Type,,
ROW:2|KEY:GENaddressintermediary,GENaddressintermediary,Jargon,Medium,Contains: intermediary,Is the registered address the same as the Intermediary principal address?,Is the registered address the same as the middle company principal address?,,
ROW:2|KEY:Contact_the_RBSI_Onboarding_Team_to_obtain_the_correct_mandate_template,Contact_the_RBSI_Onboarding_Team_to_obtain_the_correct_mandate_template,Jargon,Medium,Contains: mandate,Contact the RBSI Onboarding Team to obtain the correct mandate template,Contact the RBSI Onboarding Team to obtain the correct mandate template,,
ROW:2|KEY:GENOpeningInvestmentAdviser,GENOpeningInvestmentAdviser,Jargon,Medium,Contains: adviser,Is there an Investment Adviser?,Is there an Investment Adviser?,,
ROW:2|KEY:GENOpeningInvestmentAdviserLocation,GENOpeningInvestmentAdviserLocation,Jargon,Medium,Contains: adviser,What is the location of the Investment Adviser?,What is the location of the Investment Adviser?,,
ROW:2|KEY:GENFundMngrAdmin,GENFundMngrAdmin,Jargon,Medium,Contains: adviser,Name of fund manager/investment adviser,Name of fund manager/investment adviser,,
ROW:2|KEY:GENFundMngrIncorp,GENFundMngrIncorp,Jargon,Medium,Contains: incorporated,Where is the Fund Manager incorporated?,Where is the Fund Manager registered?,,
ROW:2|KEY:GENFundMngDom,GENFundMngDom,Jargon,Medium,Contains: domiciled,Where is the Fund Manager domiciled?,Where is the Fund Manager based?,,
ROW:2|KEY:GENFundMngrOperate,GENFundMngrOperate,Jargon,Medium,Contains: jurisdiction,Which jurisdiction does the Fund Manager operate in?	,Which country or region does the Fund Manager operate in?	,,
ROW:2|KEY:GENLawSubjectTo,GENLawSubjectTo,Jargon,Medium,Contains: entity,What is the incorporation law that the entity is currently subject to?,What is the incorporation law that the company is currently subject to?,,
ROW:2|KEY:GENStatutoryProvision,GENStatutoryProvision,Jargon,Medium,Contains: statutory,Statutory Provision for Incorporation e.g. Companies act 2006,Statutory Provision for Incorporation e.g. Companies act 2006,,
ROW:2|KEY:Please_refer_to_wwwrbsinternationalcomtaxresidency_for_more_information_on_Foreign_Account_Tax_Compliance_Act_FATCA_or_Common_Reporting_Standard_CRS_the_options_below_and_how_to_contact_us_if_necessary_If_you_have_any_further_questions_about_your_classification_please_contact_your_tax_advisor,Please_refer_to_wwwrbsinternationalcomtaxresidency_for_more_information_on_Foreign_Account_Tax_Compliance_Act_FATCA_or_Common_Reporting_Standard_CRS_the_options_below_and_how_to_contact_us_if_necessary_If_you_have_any_further_questions_about_your_classification_please_contact_your_tax_advisor,Jargon,Medium,Contains: compliance,"Please refer to: www.rbsinternational.com/taxresidency for more information on Foreign Account Tax Compliance Act (FATCA) or Common Reporting Standard (CRS), the options below and how to contact us if necessary. If you have any further questions about your classification, please contact your tax advisor","Please refer to: www.rbsinternational.com/taxresidency for more information on Foreign Account Tax Compliance Act (FATCA) or Common Reporting Standard (CRS), the options below and how to contact us if necessary. If you have any further questions about your classification, please contact your tax advisor",,
ROW:2|KEY:GENincorpUSA,GENincorpUSA,Jargon,Medium,"Contains: incorporated, entity",Is the entity/organisation incorporated/organised in the USA?,Is the company/organisation registered/organised in the USA?,,
ROW:2|KEY:GENffi,GENffi,Jargon,Medium,Contains: entity,Is the entity/organisation a Financial Foreign Institution (FFI)?,Is the company/organisation a Financial Foreign Institution (FFI)?,,
ROW:2|KEY:GENgiin,GENgiin,Jargon,Medium,Contains: intermediary,GIIN (Global Intermediary Identification No.) if applicable,GIIN (Global middle company Identification No.) if applicable,,
ROW:2|KEY:GENffisponsorname,GENffisponsorname,Jargon,Medium,Contains: entity,Name of Sponsoring Entity (if applicable),Name of Sponsoring company (if applicable),,
ROW:2|KEY:GENothergiin,GENothergiin,Jargon,Medium,Contains: intermediary,GIIN (Global Intermediary Identification No.) if applicable,GIIN (Global middle company Identification No.) if applicable,,
ROW:2|KEY:GENffiothersponsorname,GENffiothersponsorname,Jargon,Medium,Contains: entity,Name of Sponsoring Entity (if applicable),Name of Sponsoring company (if applicable),,
ROW:2|KEY:GENnonffi,GENnonffi,Jargon,Medium,Contains: entity,Is the entity/organisation a Non Financial Foreign Entity (NFFE)?,Is the company/organisation a Non Financial Foreign company (NFFE)?,,
ROW:2|KEY:GENothernffestatus,GENothernffestatus,Jargon,Medium,Contains: entity,Please provide detail of the entity’s applicable status.,Please provide detail of the company’s applicable status.,,
ROW:2|KEY:We_are_unable_to_open_an_account_for_you_at_this_time_as_we_dont_have_the_required_information_on_the_entitys_tax_status_classification,We_are_unable_to_open_an_account_for_you_at_this_time_as_we_dont_have_the_required_information_on_the_entitys_tax_status_classification,Jargon,Medium,Contains: entity,"We are unable to open an account for you at this time, as we don’t have the required information on the entity’s tax status
classification.","We are unable to open an account for you at this time, as we don’t have the required information on the company’s tax status
classification.",,
ROW:2|KEY:GENfiorinvestment,GENfiorinvestment,Jargon,Medium,Contains: entity,Is the entity/organisation a Financial Institution (FI) or Investment Entity?,Is the company/organisation a Financial Institution (FI) or Investment company?,,
ROW:2|KEY:GENnfe,GENnfe,Jargon,Medium,Contains: entity,Is the entity/organisation a Non Financial Entity (NFE)?,Is the company/organisation a Non Financial company (NFE)?,,
ROW:2|KEY:We_are_unable_to_open_an_account_for_you_at_this_time_as_we_dont_have_the_required_information_on_the_entitys_FATCACRS_tax_status,We_are_unable_to_open_an_account_for_you_at_this_time_as_we_dont_have_the_required_information_on_the_entitys_FATCACRS_tax_status,Jargon,Medium,Contains: entity,"We are unable to open an account for you at this time, as we don’t have the required information on the entity’s FATCA/CRS tax status.","We are unable to open an account for you at this time, as we don’t have the required information on the company’s FATCA/CRS tax status.",,
ROW:2|KEY:GENfatcacrscompdetails,GENfatcacrscompdetails,Jargon,Medium,Contains: entity,Please explain/provide a rationale as to how the entity meets the criteria of the FATCA/CRS status selected above.,Please explain/provide a rationale as to how the company meets the criteria of the FATCA/CRS status selected above.,,
ROW:2|KEY:GENImportFunds,GENImportFunds,Jargon,Medium,Contains: entity,Is the entity involved in the Import of Goods / Services? - OBT TO COMPLETE ,Is the company involved in the Import of Goods / Services? - OBT TO COMPLETE ,,
ROW:2|KEY:GENImportCountry,GENImportCountry,Jargon,Medium,Contains: entity,Please state the main countries from where the entity Imports from ,Please state the main countries from where the company Imports from ,,
ROW:2|KEY:GENExportFunds,GENExportFunds,Jargon,Medium,Contains: entity,Is the entity involved in the Export of Goods / Services? - OBT TO COMPLETE ,Is the company involved in the Export of Goods / Services? - OBT TO COMPLETE ,,
ROW:2|KEY:GENExportCountry,GENExportCountry,Jargon,Medium,Contains: entity,Please state the main countries from where the entity Exports to ,Please state the main countries from where the company Exports to ,,
ROW:2|KEY:GENaccnamenum,GENaccnamenum,Jargon,Medium,Contains: jurisdiction,"Please provide details of associated existing relationships (where appropriate provide a signed and dated structure/organisation chart including account names and numbers, showing the fund group structure and the jurisdictions of the entities if necessary,  and the ultimate controlling party or parties). If we bank any part of the fund structure please provide details","Please provide details of associated existing relationships (where appropriate provide a signed and dated structure/organisation chart including account names and numbers, showing the fund group structure and the country or regions of the entities if necessary,  and the ultimate controlling party or parties). If we bank any part of the fund structure please provide details",,
ROW:2|KEY:GENriskadversedetails,GENriskadversedetails,Jargon,Medium,Contains: beneficial owner,Please provide details of any other risk factor and/or adverse information you are aware of in relation to the customer or its key principals and beneficial owners.,Please provide details of any other risk factor and/or adverse information you are aware of in relation to the customer or its key principals and actual owners.,,
ROW:2|KEY:GENpepinvestors,GENpepinvestors,Jargon,Medium,Contains: beneficial owner,"Are any of the fund's investors or Ultimate Beneficial Owners (UBOs), who have a holding of 10% or more in the fund, Politically Exposed Persons (PEP)?","Are any of the fund's investors or Ultimate actual owners (UBOs), who have a holding of 10% or more in the fund, Politically Exposed Persons (PEP)?",,
ROW:2|KEY:GENpepinvestpersrelationship,GENpepinvestpersrelationship,Jargon,Medium,Contains: beneficial owner,"Are any of the fund's investors or Ultimate Beneficial Owners (UBOs) one of a group of Politically Exposed Persons (PEPs) sharing a close personal relationship, who individually may have less than 10% ownership, but together have an accumulative ownership of 10% or more?","Are any of the fund's investors or Ultimate actual owners (UBOs) one of a group of Politically Exposed Persons (PEPs) sharing a close personal relationship, who individually may have less than 10% ownership, but together have an accumulative ownership of 10% or more?",,
ROW:2|KEY:GENbearercontrol,GENbearercontrol,Jargon,Medium,Contains: intermediary,"Please confirm that the bearer shares are fully controlled by the intermediary and
will not be moved or transferred during the life of this account with the Bank?","Please confirm that the bearer shares are fully controlled by the middle company and
will not be moved or transferred during the life of this account with the Bank?",,
ROW:2|KEY:GENubohighriskcountry,GENubohighriskcountry,Jargon,Medium,Contains: beneficial owner,Do any of the investors or Ultimate Beneficial Owners (UBOs) individually or as one of a number of investors or UBOs that have a direct link to high risk countries individually or together have an accumulative ownership or control of more than 50%?,Do any of the investors or Ultimate actual owners (UBOs) individually or as one of a number of investors or UBOs that have a direct link to high risk countries individually or together have an accumulative ownership or control of more than 50%?,,
ROW:2|KEY:GENcustomerarrears,GENcustomerarrears,Jargon,Medium,Contains: entity,Please confirm if the entity has tax arrears?,Please confirm if the company has tax arrears?,,
ROW:2|KEY:GENCustomerLegal,GENCustomerLegal,Jargon,Medium,Contains: entity,Please confirm if the entity has legal proceedings outstanding?,Please confirm if the company has legal proceedings outstanding?,,
ROW:2|KEY:GENCustomerInsolvent,GENCustomerInsolvent,Jargon,Medium,Contains: entity,"Please confirm if the entity has ever been insolvent, bankrupt or had any court proceedings for debt?","Please confirm if the company has ever been insolvent, bankrupt or had any court proceedings for debt?",,
ROW:2|KEY:GENNomineeShare,GENNomineeShare,Jargon,Medium,Contains: nominee,Please advise if there are Nominee Shareholdings with no identifiable Beneficiary and/ or High Risk factors surrounding the Nominee Shareholder? - OBT TO COMPLETE,Please advise if there are Nominee Shareholdings with no identifiable Beneficiary and/ or High Risk factors surrounding the Nominee Shareholder? - OBT TO COMPLETE,,
ROW:2|KEY:GENintermediarymandate,GENintermediarymandate,Jargon,Medium,Contains: intermediary,"Do you require your standard intermediary signatory list to apply to this account, i.e. no other signatories are to be appointed?","Do you require your standard middle company signatory list to apply to this account, i.e. no other signatories are to be appointed?",,
ROW:2|KEY:Contact_your_Relationship_Team_to_obtain_the_correct_mandate_template,Contact_your_Relationship_Team_to_obtain_the_correct_mandate_template,Jargon,Medium,Contains: mandate,Contact your Relationship Team to obtain the correct mandate template,Contact your Relationship Team to obtain the correct mandate template,,
ROW:2|KEY:This_section_applies_if_the_intermediary_already_has_electronic_banking_If_not_please_speak_to_your_usual_contact_at_the_Bank_for_further_information,This_section_applies_if_the_intermediary_already_has_electronic_banking_If_not_please_speak_to_your_usual_contact_at_the_Bank_for_further_information,Jargon,Medium,Contains: intermediary,"This section applies if the intermediary already has electronic banking. If not, please speak to your usual contact at the Bank for further information.","This section applies if the middle company already has electronic banking. If not, please speak to your usual contact at the Bank for further information.",,
ROW:2|KEY:GENeQnumber,GENeQnumber,Jargon,Medium,Contains: entity,Please confirm how many eQ connections this entity should be linked to. Please fill number,Please confirm how many eQ connections this company should be linked to. Please fill number,,
ROW:2|KEY:When_adding_Key_Principals_to_the_structure_please_link_all_directors_shareholders_partners_and_corporate_entities_connected_to_the_businessorganisation_which_may_include_General_Partner_Corporate_Director_Company_Secretary_Beneficial_ownersControlling_persons_etc_For_Limited_Liability_Partnerships_please_identify_all_Managing_Partners_if_corporate_entities_include_their_ownership_For_Limited_Partnerships_please_identify_all_General_Partners_if_corporate_entities_include_their_ownership_and_also_provide_details_of_the_Directors_and_Company_Secretary_of_the_General_Partners_if_a_company_or_MembersPartners_if_a_Limited_Liability_Partnership_For_trusts_please_include_all_named_parties_to_the_trust_if_corporate_entities_include_their_ownership_Please_include_all_individualslegal_entityies_that_have_a_controlling_or_material_interest_in_the_organisationbusiness_Please_ensure_that_details_are_provided_for_every_individuallegal_entity_who_directly_or_indirectly_owns_or_controls_25_or_more_of_the_businessorganisation_and_those_that_hold_a_material_interest_for_High_Risk_applications_this_would_be_10_or_more_Refer_to_glossary_contained_in_wwwrbsinternationalcomtaxresidency_for_definition_on_Controlling_person_Material_Interest_is_defined_as_those_beneficial_ownerscontrolling_persons_who_may_have_effective_control_over_the_capital_or_assets_whilst_not_holding_a_significant_percentage_ownership_In_all_instances_full_ownership_and_control_structure_needs_to_be_keyed_or_your_application_might_be_rejected_and_you_will_be_required_to_apply_again,When_adding_Key_Principals_to_the_structure_please_link_all_directors_shareholders_partners_and_corporate_entities_connected_to_the_businessorganisation_which_may_include_General_Partner_Corporate_Director_Company_Secretary_Beneficial_ownersControlling_persons_etc_For_Limited_Liability_Partnerships_please_identify_all_Managing_Partners_if_corporate_entities_include_their_ownership_For_Limited_Partnerships_please_identify_all_General_Partners_if_corporate_entities_include_their_ownership_and_also_provide_details_of_the_Directors_and_Company_Secretary_of_the_General_Partners_if_a_company_or_MembersPartners_if_a_Limited_Liability_Partnership_For_trusts_please_include_all_named_parties_to_the_trust_if_corporate_entities_include_their_ownership_Please_include_all_individualslegal_entityies_that_have_a_controlling_or_material_interest_in_the_organisationbusiness_Please_ensure_that_details_are_provided_for_every_individuallegal_entity_who_directly_or_indirectly_owns_or_controls_25_or_more_of_the_businessorganisation_and_those_that_hold_a_material_interest_for_High_Risk_applications_this_would_be_10_or_more_Refer_to_glossary_contained_in_wwwrbsinternationalcomtaxresidency_for_definition_on_Controlling_person_Material_Interest_is_defined_as_those_beneficial_ownerscontrolling_persons_who_may_have_effective_control_over_the_capital_or_assets_whilst_not_holding_a_significant_percentage_ownership_In_all_instances_full_ownership_and_control_structure_needs_to_be_keyed_or_your_application_might_be_rejected_and_you_will_be_required_to_apply_again,Jargon,Medium,"Contains: beneficial owner, entity","When adding Key Principals to the structure, please link all directors, shareholders, partners and corporate entities connected to the business/organisation which may include General Partner, Corporate Director, Company Secretary, Beneficial owners/Controlling persons* etc.

For Limited Liability Partnerships, please identify all Managing Partners (if corporate entities include their ownership).

For Limited Partnerships, please identify all General Partners (if corporate entities include their ownership), and also provide details of the Directors and Company Secretary of the General Partner/s (if a company) or Members/Partners (if a Limited Liability Partnership).

For trusts, please include all named parties to the trust (if corporate entities include their ownership).

Please include all individual(s)/legal entity(ies) that have a controlling or material interest** in the organisation/business. Please ensure that details are provided for every individual/legal entity who directly or indirectly owns or controls 25% or more of the business/organisation and those that hold a material interest. (for High Risk applications this would be 10% or more)

*Refer to glossary contained in www.rbsinternational.com/taxresidency for definition on Controlling person.

**Material Interest is defined as those beneficial owners/controlling persons who may have effective control over the capital or assets whilst not holding a significant percentage ownership.

In all instances full ownership and control structure needs to be keyed or your application might be rejected and you will be required to apply again.","When adding Key Principals to the structure, please link all directors, shareholders, partners and corporate entities connected to the business/organisation which may include General Partner, Corporate Director, Company Secretary, actual owners/Controlling persons* etc.

For Limited Liability Partnerships, please identify all Managing Partners (if corporate entities include their ownership).

For Limited Partnerships, please identify all General Partners (if corporate entities include their ownership), and also provide details of the Directors and Company Secretary of the General Partner/s (if a company) or Members/Partners (if a Limited Liability Partnership).

For trusts, please include all named parties to the trust (if corporate entities include their ownership).

Please include all individual(s)/legal company(ies) that have a controlling or material interest** in the organisation/business. Please ensure that details are provided for every individual/legal company who directly or indirectly owns or controls 25% or more of the business/organisation and those that hold a material interest. (for High Risk applications this would be 10% or more)

*Refer to glossary contained in www.rbsinternational.com/taxresidency for definition on Controlling person.

**Material Interest is defined as those actual owners/controlling persons who may have effective control over the capital or assets whilst not holding a significant percentage ownership.

In all instances full ownership and control structure needs to be keyed or your application might be rejected and you will be required to apply again.",,
ROW:2|KEY:When_uploading_the_mandate_document_please_ensure_it_is_dated_and_has_been_signed_by_the_individuals_with_the_correct_authority,When_uploading_the_mandate_document_please_ensure_it_is_dated_and_has_been_signed_by_the_individuals_with_the_correct_authority,Jargon,Medium,Contains: mandate,When uploading the mandate document please ensure it is dated and has been signed by the individual/s with the correct authority.,When uploading the mandate document please ensure it is dated and has been signed by the individual/s with the correct authority.,,
ROW:2|KEY:GENIntermediaryID,GENIntermediaryID,Jargon,Medium,Contains: intermediary,Intermediary to be linked to CRM Customer Record,middle company to be linked to CRM Customer Record,,
ROW:2|KEY:SPEAppRFTReasonMandate,SPEAppRFTReasonMandate,Jargon,Medium,Contains: mandate,Reason for application not being completed Right First Time ( Mandate Issues),Reason for application not being completed Right First Time ( Mandate Issues),,
ROW:2|KEY:SPEAppRFTReasonMandateOther,SPEAppRFTReasonMandateOther,Jargon,Medium,Contains: mandate,Other ( Mandate Issues) - Please Specify,Other ( Mandate Issues) - Please Specify,,
ROW:2|KEY:Non_High_Appetite_Jurisdiction_Questionnaire__RD_to_complete_where_Jurisdiction_of_incorporation_of_the_entity_requiring_a_bank_account_is_a_Limited_Low_or_No_Appetite_country,Non_High_Appetite_Jurisdiction_Questionnaire__RD_to_complete_where_Jurisdiction_of_incorporation_of_the_entity_requiring_a_bank_account_is_a_Limited_Low_or_No_Appetite_country,Jargon,Medium,"Contains: jurisdiction, entity","Non High Appetite Jurisdiction Questionnaire - [RD to complete where Jurisdiction of incorporation of the entity requiring a bank account is a 'Limited', 'Low' or 'No Appetite' country]","Non High Appetite country or region Questionnaire - [RD to complete where country or region of incorporation of the company requiring a bank account is a 'Limited', 'Low' or 'No Appetite' country]",,
ROW:2|KEY:SPENonHighBusAppWhyJur,SPENonHighBusAppWhyJur,Jargon,Medium,"Contains: jurisdiction, entity",Reason why - do we understand why the entity is structured in the jurisdiction? - RD TO COMPLETE,Reason why - do we understand why the company is structured in the country or region? - RD TO COMPLETE,,
ROW:2|KEY:Non_High_Appetite_Jurisdiction_Questionnaire__Investor_base,Non_High_Appetite_Jurisdiction_Questionnaire__Investor_base,Jargon,Medium,Contains: jurisdiction,Non High Appetite Jurisdiction Questionnaire - Investor base,Non High Appetite country or region Questionnaire - Investor base,,
ROW:2|KEY:SPENonHighBusAppRegulatoryStandards,SPENonHighBusAppRegulatoryStandards,Jargon,Medium,Contains: regulatory,Has it been conducted to local regulatory standards? - RD TO COMPLETE,Has it been conducted to local regulatory standards? - RD TO COMPLETE,,
ROW:2|KEY:Non_High_Appetite_Jurisdiction_Questionnaire__Investment_Strategy,Non_High_Appetite_Jurisdiction_Questionnaire__Investment_Strategy,Jargon,Medium,Contains: jurisdiction,Non High Appetite Jurisdiction Questionnaire - Investment Strategy ,Non High Appetite country or region Questionnaire - Investment Strategy ,,
ROW:2|KEY:Non_High_Appetite_Jurisdiction_Questionnaire__Constitution_and_Capacity,Non_High_Appetite_Jurisdiction_Questionnaire__Constitution_and_Capacity,Jargon,Medium,Contains: jurisdiction,Non High Appetite Jurisdiction Questionnaire - Constitution and Capacity ,Non High Appetite country or region Questionnaire - Constitution and Capacity ,,
ROW:2|KEY:SPENonHighBusAppEntityProperlyFormed,SPENonHighBusAppEntityProperlyFormed,Jargon,Medium,Contains: entity,Is entity properly formed and does it/the officers have capacity? - RD TO COMPLETE,Is company properly formed and does it/the officers have capacity? - RD TO COMPLETE,,
