row_ref,field_key,issue_type,severity,details,original,suggestion,human_decision,notes
ROW:2|KEY:If_you_are_applying_for_an_account_in_the_UK_but_the_entity_for_which_you_are_requesting_an_account_is_not_incorporated_in_the_UK_you_may_wish_to_contact_your_Relationship_Director_first_in_order_to_discuss_your_requirements,If_you_are_applying_for_an_account_in_the_UK_but_the_entity_for_which_you_are_requesting_an_account_is_not_incorporated_in_the_UK_you_may_wish_to_contact_your_Relationship_Director_first_in_order_to_discuss_your_requirements,Too Long,High,41 words,"If you are applying for an account in the UK but the entity for which you are requesting an account is not incorporated in the UK, you may wish to contact your Relationship Director first, in order to discuss your requirements","If you are applying for an account in the UK but the entity for which you are requesting an account is not incorporated in the UK, you may wish to contact your Relationship Director first, to discuss your requirements",,
ROW:2|KEY:GENIndicativeAppetitePeppositioninfluence,GENIndicativeAppetitePeppositioninfluence,Too Long,High,31 words,"Are there any Politically Exposed Persons (PEPs) that are not an owner or controller, who hold a position of significant influence including but not limited to the provider of a loan?","Are there any Politically Exposed Persons (PEPs) that are not an owner or controller, who hold a position of significant influence including but not limited to the provider of a loan?",,
ROW:2|KEY:GENIndicativeAppetitePepinvestpersrelationship,GENIndicativeAppetitePepinvestpersrelationship,Too Long,High,43 words,"Are any of the fund's investors or Ultimate Beneficial Owners (UBOs) one of a group of Politically Exposed Persons (PEPs) sharing a close personal relationship, who individually may have less than 10% ownership, but together have an accumulative ownership of 10% or more?","Are any of the fund's investors or Ultimate Beneficial Owners (UBOs) one of a group of Politically Exposed Persons (PEPs) sharing a close personal relationship, who individually may have less than 10% ownership, but together have an accumulative ownership of 10% or more?",,
ROW:2|KEY:GENIndicativeAppetiteRBSIProductOptionsComplex,GENIndicativeAppetiteRBSIProductOptionsComplex,Too Long,High,41 words,RBSI is a relationship focussed bank and as such our appetite to open bank accounts is higher where we provide other bank products. Please highlight below what RBSI products you currently benefit from or would like to consider in the future?,RBSI is a relationship focussed bank and as such our appetite to open bank accounts is higher where we provide other bank products. Please highlight below what RBSI products you currently benefit from or would like to consider in the future?,,
ROW:2|KEY:GENUKIndicativeAppetitePeppositioninfluence,GENUKIndicativeAppetitePeppositioninfluence,Too Long,High,31 words,"Are there any Politically Exposed Persons (PEPs) that are not an owner or controller, who hold a position of significant influence including but not limited to the provider of a loan?","Are there any Politically Exposed Persons (PEPs) that are not an owner or controller, who hold a position of significant influence including but not limited to the provider of a loan?",,
ROW:2|KEY:GENUKIndicativeAppetitePepinvestpersrelationship,GENUKIndicativeAppetitePepinvestpersrelationship,Too Long,High,43 words,"Are any of the fund's investors or Ultimate Beneficial Owners (UBOs) one of a group of Politically Exposed Persons (PEPs) sharing a close personal relationship, who individually may have less than 10% ownership, but together have an accumulative ownership of 10% or more?","Are any of the fund's investors or Ultimate Beneficial Owners (UBOs) one of a group of Politically Exposed Persons (PEPs) sharing a close personal relationship, who individually may have less than 10% ownership, but together have an accumulative ownership of 10% or more?",,
ROW:2|KEY:GENUKIndicativeAppetiteRBSIProductOptionsComplex,GENUKIndicativeAppetiteRBSIProductOptionsComplex,Too Long,High,41 words,RBSI is a relationship focussed bank and as such our appetite to open bank accounts is higher where we provide other bank products. Please highlight below what RBSI products you currently benefit from or would like to consider in the future?,RBSI is a relationship focussed bank and as such our appetite to open bank accounts is higher where we provide other bank products. Please highlight below what RBSI products you currently benefit from or would like to consider in the future?,,
ROW:2|KEY:GENConsolidated,GENConsolidated,Too Long,High,64 words,"Does the consolidated group / fund, as at the latest financial year consolidated accounts satisfy two or more of the following: (1)  income of more than £5.6m?  (2)  total assets (gross) on balance Sheet of more than £2.8m? (3) more than 50 employees? (Please note, we will require evidence of this by way of financial accounts and/or investor report as part of this application.)","Does the consolidated group / fund, as at the latest financial year consolidated accounts satisfy two or more of the following: (1) income of more than £5.6m?",,
ROW:2|KEY:GENStandalone,GENStandalone,Too Long,High,65 words,"Does the entity (on a standalone basis), as at the latest financial year individual accounts have two or more of the following: (1)  income of more than £5.6m?  (2)  total assets (gross) on balance Sheet of more than £2.8m? (3) more than 50 employees? (Please note, we will require evidence of this by way of financial accounts and/or investor report as part of this application.)","Does the entity (on a standalone basis), as at the latest financial year individual accounts have two or more of the following: (1) income of more than £5.6m?",,
ROW:2|KEY:GENHalfyearConsolidated,GENHalfyearConsolidated,Too Long,High,61 words,"Within the next 6 months, does the consolidated group/fund  expect to have two or more of the following: (1)  income of more than £5.6m?  (2)  total assets (gross) on balance Sheet of more than £2.8m? (3) more than 50 employees? (Please note, we will require evidence of this by way of financial accounts and/or investor report as part of this application.)","Within the next 6 months, does the consolidated group/fund expect to have two or more of the following: (1) income of more than £5.6m?",,
ROW:2|KEY:GENHalfyearStandalone,GENHalfyearStandalone,Too Long,High,72 words,"Within the next 6 months, does the entity (on a standalone basis), as at the latest financial year individual accounts expect to have two or more of the following: (1)  income of more than £5.6m?  (2)  total assets (gross) on balance Sheet of more than £2.8m? (3) more than 50 employees? (Please note, we will require evidence of this by way of financial accounts and/or investor report as part of this application.)","Within the next 6 months, does the entity (on a standalone basis), as at the latest financial year individual accounts expect to have two or more of the following: (1) income of more than £5.6m?",,
ROW:2|KEY:GENStandaloneNetAssetsType,GENStandaloneNetAssetsType,Too Long,High,59 words,"Does the entity (on a standalone basis), a) currently have net assets of > £1.4m, (b) is expected to have net assets of > £1.4m within 6 months or (c) have net assets of ≤ £1.4m? (Please note, we will require evidence of (a) by way of financial accounts or investor report (or for (b) - within 6 months).)","Does the entity (on a standalone basis), a) currently have net assets of > £1.4m, (b) is expected to have net assets of > £1.4m within 6 months or (c) have net assets of ≤ £1.4m?",,
ROW:2|KEY:SPEWholesaleDepositorIn6Months,SPEWholesaleDepositorIn6Months,Too Long,High,52 words,"If the wholesale depositor has not been met at the time of the account being opened, will it meet the requirement in the next 6 months and is the customer aware that if they do not meet this requirement we may have to close the account(s) in question - RD TO COMPLETE","If the wholesale depositor has not been met at the time of the account being opened, will it meet the requirement in the next 6 months and is the customer aware that if they do not meet this requirement we may have to close the account(s) in question - RD TO COMPLETE",,
ROW:2|KEY:SPERationaleOffshoreAccount,SPERationaleOffshoreAccount,Too Long,High,32 words,"If your customer is not a resident of the jurisdiction where you are applying for an account to be opened, please provide rationale justifying why an account is required in this jurisdiction","If your customer is not a resident of the jurisdiction where you are applying for an account to be opened, enter rationale justifying why an account is required in this jurisdiction",,
ROW:2|KEY:As_you_have_stated_that_neither_you_nor_a_Third_party_have_met_the_customer_face_to_face_it_is_unlikely_that_we_will_be_able_to_open_a_bank_account_for_your_customer_We_would_advise_you_not_to_complete_the_rest_of_this_application_without_first_having_discussed_this_with_your_Relationship_Director,As_you_have_stated_that_neither_you_nor_a_Third_party_have_met_the_customer_face_to_face_it_is_unlikely_that_we_will_be_able_to_open_a_bank_account_for_your_customer_We_would_advise_you_not_to_complete_the_rest_of_this_application_without_first_having_discussed_this_with_your_Relationship_Director,Too Long,High,55 words,"As you have stated that neither you nor a Third party have met the customer face to face, it is unlikely that we will be able to open a bank account for your customer. We would advise you not to complete the rest of this application without first having discussed this with your Relationship Director.","As you have stated that neither you nor a Third party have met the customer face to face, it is unlikely that we will be able to open a bank account for your customer. We would advise you not to complete the rest of this application without first having discussed this with your Relationship Director.",,
ROW:2|KEY:GENIntroductionChainLayers,GENIntroductionChainLayers,Too Long,High,34 words,Please specify the number of layers in the chain of introduction between your relationship with this customer and the 3rd party that has met the customer face to face to undertake Due Diligence certification.,Please specify the number of layers in the chain of introduction between your relationship with this customer and the 3rd party that has met the customer face to face to undertake Due Diligence certification.,,
ROW:2|KEY:As_you_have_stated_that_there_are_more_than_3_layers_in_the_chain_of_introduction_between_your_relationship_with_this_customer_and_the_3rd_party_that_has_met_the_customer_face_to_face_it_is_unlikely_that_we_will_be_able_to_open_a_bank_account_for_your_customer_We_would_advise_you_not_to_complete_the_rest_of_this_application_without_first_having_discussed_this_with_your_Relationship_Director,As_you_have_stated_that_there_are_more_than_3_layers_in_the_chain_of_introduction_between_your_relationship_with_this_customer_and_the_3rd_party_that_has_met_the_customer_face_to_face_it_is_unlikely_that_we_will_be_able_to_open_a_bank_account_for_your_customer_We_would_advise_you_not_to_complete_the_rest_of_this_application_without_first_having_discussed_this_with_your_Relationship_Director,Too Long,High,71 words,"As you have stated that there are more than 3 layers in the chain of introduction between your relationship with this customer and the 3rd party that has met the customer face to face, it is unlikely that we will be able to open a bank account for your customer. We would  advise you not to complete the rest of this application without first having discussed this with your Relationship Director.","As you have stated that there are more than 3 layers in the chain of introduction between your relationship with this customer and the 3rd party that has met the customer face to face, it is unlikely that we will be able to open a bank account for your customer. We would advise you not to complete the rest of this application without first having discussed this with your Relationship Director.",,
ROW:2|KEY:Please_complete_the_following_questions_as_accurately_as_possible_and_provide_full_answers_where_possible_The_quality_of_the_information_you_provide_in_this_application_will_directly_impact_the_time_that_it_takes_for_your_account_to_be_opened,Please_complete_the_following_questions_as_accurately_as_possible_and_provide_full_answers_where_possible_The_quality_of_the_information_you_provide_in_this_application_will_directly_impact_the_time_that_it_takes_for_your_account_to_be_opened,Too Long,High,39 words,Please complete the following questions as accurately as possible and provide full answers where possible. The quality of the information you provide in this application will directly impact the time that it takes for your account to be opened.,Please complete the following questions as accurately as possible and provide full answers where possible. The quality of the information you provide in this application will directly impact the time that it takes for your account to be opened.,,
ROW:2|KEY:GENCountryRegistrationJurisdictionMismatchRationale,GENCountryRegistrationJurisdictionMismatchRationale,Too Long,High,32 words,The country of Registration/Formation selected does not match the jurisdiction where you are applying for an account to be opened. Please provide rationale justifying why an account is required in this jurisdiction:,The country of Registration/Formation selected does not match the jurisdiction where you are applying for an account to be opened. enter rationale justifying why an account is required in this jurisdiction:,,
ROW:2|KEY:Please_refer_to_wwwrbsinternationalcomtaxresidency_for_more_information_on_Foreign_Account_Tax_Compliance_Act_FATCA_or_Common_Reporting_Standard_CRS_the_options_below_and_how_to_contact_us_if_necessary_If_you_have_any_further_questions_about_your_classification_please_contact_your_tax_advisor,Please_refer_to_wwwrbsinternationalcomtaxresidency_for_more_information_on_Foreign_Account_Tax_Compliance_Act_FATCA_or_Common_Reporting_Standard_CRS_the_options_below_and_how_to_contact_us_if_necessary_If_you_have_any_further_questions_about_your_classification_please_contact_your_tax_advisor,Too Long,High,43 words,"Please refer to: www.rbsinternational.com/taxresidency for more information on Foreign Account Tax Compliance Act (FATCA) or Common Reporting Standard (CRS), the options below and how to contact us if necessary. If you have any further questions about your classification, please contact your tax advisor","Please refer to: www.rbsinternational.com/taxresidency for more information on Foreign Account Tax Compliance Act (FATCA) or Common Reporting Standard (CRS), the options below and how to contact us if necessary. If you have any further questions about your classification, please contact your tax advisor",,
ROW:2|KEY:Please_complete_the_following_questions_as_accurately_as_possible_and_provide_full_answers_where_possible_The_quality_of_the_information_you_provide_in_this_application_will_directly_impact_the_time_that_it_takes_for_your_account_to_be_opened,Please_complete_the_following_questions_as_accurately_as_possible_and_provide_full_answers_where_possible_The_quality_of_the_information_you_provide_in_this_application_will_directly_impact_the_time_that_it_takes_for_your_account_to_be_opened,Too Long,High,39 words,Please complete the following questions as accurately as possible and provide full answers where possible. The quality of the information you provide in this application will directly impact the time that it takes for your account to be opened.,Please complete the following questions as accurately as possible and provide full answers where possible. The quality of the information you provide in this application will directly impact the time that it takes for your account to be opened.,,
ROW:2|KEY:GENInvestorCountryComplex,GENInvestorCountryComplex,Too Long,High,43 words,"Please provide details of the typical investors the fund is targeted at, e.g. institutional, private client, retail etc and where the investors are likely to be based. Please also include the percentage of each type of investor, e.g. 50% institutional, 50% private client.","enter details of the typical investors the fund is targeted at, e.g. institutional, private client, retail etc and where the investors are likely to be based. Please also include the percentage of each type of investor, e.g. 50% institutional, 50% private client.",,
ROW:2|KEY:Please_complete_the_following_questions_as_accurately_as_possible_and_provide_full_answers_where_possible_The_quality_of_the_information_you_provide_in_this_application_will_directly_impact_the_time_that_it_takes_for_your_account_to_be_opened,Please_complete_the_following_questions_as_accurately_as_possible_and_provide_full_answers_where_possible_The_quality_of_the_information_you_provide_in_this_application_will_directly_impact_the_time_that_it_takes_for_your_account_to_be_opened,Too Long,High,39 words,Please complete the following questions as accurately as possible and provide full answers where possible. The quality of the information you provide in this application will directly impact the time that it takes for your account to be opened.,Please complete the following questions as accurately as possible and provide full answers where possible. The quality of the information you provide in this application will directly impact the time that it takes for your account to be opened.,,
ROW:2|KEY:GENaccnamenum,GENaccnamenum,Too Long,High,53 words,"Please provide details of associated existing relationships (where appropriate provide a signed and dated structure/organisation chart including account names and numbers, showing the fund group structure and the jurisdictions of the entities if necessary,  and the ultimate controlling party or parties). If we bank any part of the fund structure please provide details","enter details of associated existing relationships (where appropriate provide a signed and dated structure/organisation chart including account names and numbers, showing the fund group structure and the jurisdictions of the entities if necessary, and the ultimate controlling party or parties). If we bank any part of the fund structure enter details",,
ROW:2|KEY:Please_complete_the_following_questions_as_accurately_as_possible_and_provide_full_answers_where_possible_The_quality_of_the_information_you_provide_in_this_application_will_directly_impact_the_time_that_it_takes_for_your_account_to_be_opened,Please_complete_the_following_questions_as_accurately_as_possible_and_provide_full_answers_where_possible_The_quality_of_the_information_you_provide_in_this_application_will_directly_impact_the_time_that_it_takes_for_your_account_to_be_opened,Too Long,High,39 words,Please complete the following questions as accurately as possible and provide full answers where possible. The quality of the information you provide in this application will directly impact the time that it takes for your account to be opened.,Please complete the following questions as accurately as possible and provide full answers where possible. The quality of the information you provide in this application will directly impact the time that it takes for your account to be opened.,,
ROW:2|KEY:GENpepinvestpersrelationship,GENpepinvestpersrelationship,Too Long,High,43 words,"Are any of the fund's investors or Ultimate Beneficial Owners (UBOs) one of a group of Politically Exposed Persons (PEPs) sharing a close personal relationship, who individually may have less than 10% ownership, but together have an accumulative ownership of 10% or more?","Are any of the fund's investors or Ultimate Beneficial Owners (UBOs) one of a group of Politically Exposed Persons (PEPs) sharing a close personal relationship, who individually may have less than 10% ownership, but together have an accumulative ownership of 10% or more?",,
ROW:2|KEY:GENpeppositioninfluence,GENpeppositioninfluence,Too Long,High,31 words,"Are there any Politially Exposed Persons (PEPs) that are not an owner or controller, who hold a position of significant influence including but not limited to the provider of a loan?","Are there any Politially Exposed Persons (PEPs) that are not an owner or controller, who hold a position of significant influence including but not limited to the provider of a loan?",,
ROW:2|KEY:GENubohighriskcountry,GENubohighriskcountry,Too Long,High,43 words,Do any of the investors or Ultimate Beneficial Owners (UBOs) individually or as one of a number of investors or UBOs that have a direct link to high risk countries individually or together have an accumulative ownership or control of more than 50%?,Do any of the investors or Ultimate Beneficial Owners (UBOs) individually or as one of a number of investors or UBOs that have a direct link to high risk countries individually or together have an accumulative ownership or control of more than 50%?,,
ROW:2|KEY:GENUnusualCircumstances,GENUnusualCircumstances,Too Long,High,36 words,"The business relationship is conducted in unusual circumstances, such as: - Complex and unusually large transactions - Unusual patterns of transactions - Where the transactions have no apparent economic or legal purpose - OBT TO COMPLETE","The business relationship is conducted in unusual circumstances, such as: - Complex and unusually large transactions - Unusual patterns of transactions - Where the transactions have no apparent economic or legal purpose - OBT TO COMPLETE",,
ROW:2|KEY:Please_complete_the_following_questions_as_accurately_as_possible_and_provide_full_answers_where_possible_The_quality_of_the_information_you_provide_in_this_application_will_directly_impact_the_time_that_it_takes_for_your_account_to_be_opened,Please_complete_the_following_questions_as_accurately_as_possible_and_provide_full_answers_where_possible_The_quality_of_the_information_you_provide_in_this_application_will_directly_impact_the_time_that_it_takes_for_your_account_to_be_opened,Too Long,High,39 words,Please complete the following questions as accurately as possible and provide full answers where possible. The quality of the information you provide in this application will directly impact the time that it takes for your account to be opened.,Please complete the following questions as accurately as possible and provide full answers where possible. The quality of the information you provide in this application will directly impact the time that it takes for your account to be opened.,,
ROW:2|KEY:GENCashMngtAccPurpose,GENCashMngtAccPurpose,Too Long,High,38 words,"Please advise what the account is to be used for. For example, a combination of the following: payments of professional fees, dividend receipts/payments, rental income, expenses, trading income, purchases of wholesale goods, cash elements of an investment portfolio.","Please advise what the account is to be used for. For example, a combination of the following: payments of professional fees, dividend receipts/payments, rental income, expenses, trading income, purchases of wholesale goods, cash elements of an investment portfolio.",,
ROW:2|KEY:GENCurrentAccPurpose,GENCurrentAccPurpose,Too Long,High,38 words,"Please advise what the account is to be used for. For example, a combination of the following: payments of professional fees, dividend receipts/payments, rental income, expenses, trading income, purchases of wholesale goods, cash elements of an investment portfolio.","Please advise what the account is to be used for. For example, a combination of the following: payments of professional fees, dividend receipts/payments, rental income, expenses, trading income, purchases of wholesale goods, cash elements of an investment portfolio.",,
