row_ref,field_key,issue_type,severity,details,original,suggestion,human_decision,notes
ROW:2|KEY:GENStandalone,GENStandalone,Complex Sentence,Medium,Multiple clauses,"Does the entity (on a standalone basis), as at the latest financial year individual accounts have two or more of the following: (1)  income of more than £5.6m?  (2)  total assets (gross) on balance Sheet of more than £2.8m? (3) more than 50 employees? (Please note, we will require evidence of this by way of financial accounts and/or investor report as part of this application.)",as at the latest financial year individual accounts have two or more of the following: (1)  income of more than £5.6m?  (2)  total assets (gross) on balance Sheet of more than £2.8m? (3) more than 50 employees? (Please note,,
ROW:2|KEY:GENHalfyearConsolidated,GENHalfyearConsolidated,Complex Sentence,Medium,Multiple clauses,"Within the next 6 months, does the consolidated group/fund  expect to have two or more of the following: (1)  income of more than £5.6m?  (2)  total assets (gross) on balance Sheet of more than £2.8m? (3) more than 50 employees? (Please note, we will require evidence of this by way of financial accounts and/or investor report as part of this application.)",does the consolidated group/fund  expect to have two or more of the following: (1)  income of more than £5.6m?  (2)  total assets (gross) on balance Sheet of more than £2.8m? (3) more than 50 employees? (Please note,,
ROW:2|KEY:GENHalfyearStandalone,GENHalfyearStandalone,Complex Sentence,Medium,Multiple clauses,"Within the next 6 months, does the entity (on a standalone basis), as at the latest financial year individual accounts expect to have two or more of the following: (1)  income of more than £5.6m?  (2)  total assets (gross) on balance Sheet of more than £2.8m? (3) more than 50 employees? (Please note, we will require evidence of this by way of financial accounts and/or investor report as part of this application.)",as at the latest financial year individual accounts expect to have two or more of the following: (1)  income of more than £5.6m?  (2)  total assets (gross) on balance Sheet of more than £2.8m? (3) more than 50 employees? (Please note,,
ROW:2|KEY:GENStandaloneNetAssetsType,GENStandaloneNetAssetsType,Complex Sentence,Medium,Multiple clauses,"Does the entity (on a standalone basis), a) currently have net assets of > £1.4m, (b) is expected to have net assets of > £1.4m within 6 months or (c) have net assets of ≤ £1.4m? (Please note, we will require evidence of (a) by way of financial accounts or investor report (or for (b) - within 6 months).)",(b) is expected to have net assets of > £1.4m within 6 months or (c) have net assets of ≤ £1.4m? (Please note,,
ROW:2|KEY:SPEWholesaleDepositorIn6Months,SPEWholesaleDepositorIn6Months,Complex Sentence,Medium,Multiple clauses,"If the wholesale depositor has not been met at the time of the account being opened, will it meet the requirement in the next 6 months and is the customer aware that if they do not meet this requirement we may have to close the account(s) in question - RD TO COMPLETE",If the wholesale depositor has not been met at the time of the account being opened,,
ROW:2|KEY:SPEWholesaleDepositorApproval,SPEWholesaleDepositorApproval,Complex Sentence,Medium,Multiple clauses,"Wholesale depositor approval, confirmation is accurate as per the information provided - LIST B DELEGATE TO COMPLETE",Wholesale depositor approval,,
ROW:2|KEY:SPERationaleOffshoreAccount,SPERationaleOffshoreAccount,Complex Sentence,Medium,Multiple clauses,"If your customer is not a resident of the jurisdiction where you are applying for an account to be opened, please provide rationale justifying why an account is required in this jurisdiction",If your customer is not a resident of the jurisdiction where you are applying for an account to be opened,,
ROW:2|KEY:SPEIntroducingName,SPEIntroducingName,Complex Sentence,Medium,Multiple clauses,"Please confirm full name of the introducer you are using for this application. [Are you a third party introducer, or are you direct?]",Please confirm full name of the introducer you are using for this application. [Are you a third party introducer,,
ROW:2|KEY:GENMetFaceToFace,GENMetFaceToFace,Complex Sentence,Medium,Multiple clauses,"Have you (or an individual from your wider internal group) met the customer for whom this account relates, face to face and in accordance with local regulation?",Have you (or an individual from your wider internal group) met the customer for whom this account relates,,
ROW:2|KEY:If_Yes_please_detail_the_name_and_position_of_the_individual_from_your_group_that_has_met_the_customer_including_the_date_the_meeting_was_held,If_Yes_please_detail_the_name_and_position_of_the_individual_from_your_group_that_has_met_the_customer_including_the_date_the_meeting_was_held,Complex Sentence,Medium,Multiple clauses,"If Yes, please detail the name and position of the individual from your group that has met the customer including the date the meeting was held.",If Yes,,
ROW:2|KEY:If_Yes_please_detail_the_name_and_position_of_the_individual_representing_the_customer_and_the_RBSI_employee_that_met_this_individual_and_include_the_date_the_meeting_was_held,If_Yes_please_detail_the_name_and_position_of_the_individual_representing_the_customer_and_the_RBSI_employee_that_met_this_individual_and_include_the_date_the_meeting_was_held,Complex Sentence,Medium,Multiple clauses,"If Yes, please detail the name and position of the individual representing the customer, and the RBSI employee that met this individual, and include the date the meeting was held.",If Yes,,
ROW:2|KEY:As_you_have_stated_that_neither_you_nor_a_Third_party_have_met_the_customer_face_to_face_it_is_unlikely_that_we_will_be_able_to_open_a_bank_account_for_your_customer_We_would_advise_you_not_to_complete_the_rest_of_this_application_without_first_having_discussed_this_with_your_Relationship_Director,As_you_have_stated_that_neither_you_nor_a_Third_party_have_met_the_customer_face_to_face_it_is_unlikely_that_we_will_be_able_to_open_a_bank_account_for_your_customer_We_would_advise_you_not_to_complete_the_rest_of_this_application_without_first_having_discussed_this_with_your_Relationship_Director,Complex Sentence,Medium,Multiple clauses,"As you have stated that neither you nor a Third party have met the customer face to face, it is unlikely that we will be able to open a bank account for your customer. We would advise you not to complete the rest of this application without first having discussed this with your Relationship Director.",As you have stated that neither you nor a Third party have met the customer face to face,,
ROW:2|KEY:As_you_have_stated_that_there_are_more_than_3_layers_in_the_chain_of_introduction_between_your_relationship_with_this_customer_and_the_3rd_party_that_has_met_the_customer_face_to_face_it_is_unlikely_that_we_will_be_able_to_open_a_bank_account_for_your_customer_We_would_advise_you_not_to_complete_the_rest_of_this_application_without_first_having_discussed_this_with_your_Relationship_Director,As_you_have_stated_that_there_are_more_than_3_layers_in_the_chain_of_introduction_between_your_relationship_with_this_customer_and_the_3rd_party_that_has_met_the_customer_face_to_face_it_is_unlikely_that_we_will_be_able_to_open_a_bank_account_for_your_customer_We_would_advise_you_not_to_complete_the_rest_of_this_application_without_first_having_discussed_this_with_your_Relationship_Director,Complex Sentence,Medium,Multiple clauses,"As you have stated that there are more than 3 layers in the chain of introduction between your relationship with this customer and the 3rd party that has met the customer face to face, it is unlikely that we will be able to open a bank account for your customer. We would  advise you not to complete the rest of this application without first having discussed this with your Relationship Director.",As you have stated that there are more than 3 layers in the chain of introduction between your relationship with this customer and the 3rd party that has met the customer face to face,,
ROW:209|KEY:GENRegAddressFor3Years,GENRegAddressFor3Years,Complex Sentence,Medium,Multiple clauses,"Have you had the same registered address for the past 3 years? If not, please enter all addresses within the past 3 year",Have you had the same registered address for the past 3 years? If not,,
ROW:2|KEY:GENfundarrearslegalinsolvent,GENfundarrearslegalinsolvent,Complex Sentence,Medium,Multiple clauses,"Please confirm if the customer structure has tax arrears or legal proceeding outstanding or has ever been insolvent, bankrupt or had any court proceedings for debt?",Please confirm if the customer structure has tax arrears or legal proceeding outstanding or has ever been insolvent,,
ROW:2|KEY:Please_refer_to_wwwrbsinternationalcomtaxresidency_for_more_information_on_Foreign_Account_Tax_Compliance_Act_FATCA_or_Common_Reporting_Standard_CRS_the_options_below_and_how_to_contact_us_if_necessary_If_you_have_any_further_questions_about_your_classification_please_contact_your_tax_advisor,Please_refer_to_wwwrbsinternationalcomtaxresidency_for_more_information_on_Foreign_Account_Tax_Compliance_Act_FATCA_or_Common_Reporting_Standard_CRS_the_options_below_and_how_to_contact_us_if_necessary_If_you_have_any_further_questions_about_your_classification_please_contact_your_tax_advisor,Complex Sentence,Medium,Multiple clauses,"Please refer to: www.rbsinternational.com/taxresidency for more information on Foreign Account Tax Compliance Act (FATCA) or Common Reporting Standard (CRS), the options below and how to contact us if necessary. If you have any further questions about your classification, please contact your tax advisor",Please refer to: www.rbsinternational.com/taxresidency for more information on Foreign Account Tax Compliance Act (FATCA) or Common Reporting Standard (CRS),,
ROW:2|KEY:We_are_unable_to_open_an_account_for_you_at_this_time_as_we_dont_have_the_required_information_on_the_entitys_tax_status_classification,We_are_unable_to_open_an_account_for_you_at_this_time_as_we_dont_have_the_required_information_on_the_entitys_tax_status_classification,Complex Sentence,Medium,Multiple clauses,"We are unable to open an account for you at this time, as we don’t have the required information on the entity’s tax status
classification.",We are unable to open an account for you at this time,,
ROW:2|KEY:We_are_unable_to_open_an_account_for_you_at_this_time_as_we_dont_have_the_required_information_on_the_entitys_FATCACRS_tax_status,We_are_unable_to_open_an_account_for_you_at_this_time_as_we_dont_have_the_required_information_on_the_entitys_FATCACRS_tax_status,Complex Sentence,Medium,Multiple clauses,"We are unable to open an account for you at this time, as we don’t have the required information on the entity’s FATCA/CRS tax status.",We are unable to open an account for you at this time,,
ROW:2|KEY:GENFundDescription,GENFundDescription,Complex Sentence,Medium,Multiple clauses,"Please provide a detailed description of the investment activities of the fund, including the type of investments and detail of the asset classes and sectors",Please provide a detailed description of the investment activities of the fund,,
ROW:2|KEY:GENFundSizeExtreme,GENFundSizeExtreme,Complex Sentence,Medium,Multiple clauses,"As you have advised that the fund size is greater than 10 billion, please enter the exact fund size/ targeted fund size",As you have advised that the fund size is greater than 10 billion,,
ROW:2|KEY:GENFundTargetedSizeExtreme,GENFundTargetedSizeExtreme,Complex Sentence,Medium,Multiple clauses,"As you have advised that the fund size is greater than 10 billion, please enter the exact fund size/ targeted fund size",As you have advised that the fund size is greater than 10 billion,,
ROW:2|KEY:GENFundDates,GENFundDates,Complex Sentence,Medium,Multiple clauses,"What is the scheduled launch date and target size of the fund?  If a closed ended fund, what is/was the date of final close?",What is the scheduled launch date and target size of the fund?  If a closed ended fund,,
ROW:2|KEY:GENInvestmentCountrydontknowpercentage,GENInvestmentCountrydontknowpercentage,Complex Sentence,Medium,Multiple clauses,"When will you know the percentage investment in this country, so that you can come back to us with this information?	",When will you know the percentage investment in this country,,
ROW:2|KEY:GENInvestorCountryComplex,GENInvestorCountryComplex,Complex Sentence,Medium,Multiple clauses,"Please provide details of the typical investors the fund is targeted at, e.g. institutional, private client, retail etc and where the investors are likely to be based. Please also include the percentage of each type of investor, e.g. 50% institutional, 50% private client.",Please provide details of the typical investors the fund is targeted at,,
ROW:2|KEY:GENaccnamenum,GENaccnamenum,Complex Sentence,Medium,Multiple clauses,"Please provide details of associated existing relationships (where appropriate provide a signed and dated structure/organisation chart including account names and numbers, showing the fund group structure and the jurisdictions of the entities if necessary,  and the ultimate controlling party or parties). If we bank any part of the fund structure please provide details",Please provide details of associated existing relationships (where appropriate provide a signed and dated structure/organisation chart including account names and numbers,,
ROW:2|KEY:GENriskadverse,GENriskadverse,Complex Sentence,Medium,Multiple clauses,"Are there any Reputational, Environmental, Social and Ethical (ESE) or tax risks associated with the application?",Social and Ethical (ESE) or tax risks associated with the application?,,
ROW:2|KEY:GENpepinvestors,GENpepinvestors,Complex Sentence,Medium,Multiple clauses,"Are any of the fund's investors or Ultimate Beneficial Owners (UBOs), who have a holding of 10% or more in the fund, Politically Exposed Persons (PEP)?",Politically Exposed Persons (PEP)?,,
ROW:2|KEY:GENpepinvestpersrelationship,GENpepinvestpersrelationship,Complex Sentence,Medium,Multiple clauses,"Are any of the fund's investors or Ultimate Beneficial Owners (UBOs) one of a group of Politically Exposed Persons (PEPs) sharing a close personal relationship, who individually may have less than 10% ownership, but together have an accumulative ownership of 10% or more?",but together have an accumulative ownership of 10% or more?,,
ROW:2|KEY:GENpepdirectorcontroller,GENpepdirectorcontroller,Complex Sentence,Medium,Multiple clauses,"Are there any Politically Exposed Persons (PEPs) involved in running/operating, controlling or advising the fund?",Are there any Politically Exposed Persons (PEPs) involved in running/operating,,
ROW:2|KEY:GENpeppositioninfluence,GENpeppositioninfluence,Complex Sentence,Medium,Multiple clauses,"Are there any Politially Exposed Persons (PEPs) that are not an owner or controller, who hold a position of significant influence including but not limited to the provider of a loan?",Are there any Politially Exposed Persons (PEPs) that are not an owner or controller,,
ROW:2|KEY:GENCustomerInsolvent,GENCustomerInsolvent,Complex Sentence,Medium,Multiple clauses,"Please confirm if the entity has ever been insolvent, bankrupt or had any court proceedings for debt?",Please confirm if the entity has ever been insolvent,,
ROW:2|KEY:GENUnusualCircumstances,GENUnusualCircumstances,Complex Sentence,Medium,Multiple clauses,"The business relationship is conducted in unusual circumstances, such as: - Complex and unusually large transactions - Unusual patterns of transactions - Where the transactions have no apparent economic or legal purpose - OBT TO COMPLETE",The business relationship is conducted in unusual circumstances,,
ROW:2|KEY:GENAccDesignation,GENAccDesignation,Complex Sentence,Medium,Multiple clauses,"This account will be in the name of your business. Please confirm if you require an additional designation or reference e.g. Office account, Collections account, Rental account?",Rental account?,,
ROW:2|KEY:GENAccCashActivityDetail,GENAccCashActivityDetail,Complex Sentence,Medium,Multiple clauses,"Please provide as much information as possible regarding these cash transactions(e.g. frequency, value, location,etc.)",Please provide as much information as possible regarding these cash transactions(e.g. frequency,,
ROW:2|KEY:GENAccStatFreq,GENAccStatFreq,Complex Sentence,Medium,Multiple clauses,"Statements will be set on an annual default frequency. Should you require these more frequently, please indicate here:",Statements will be set on an annual default frequency. Should you require these more frequently,,
ROW:2|KEY:GENCashMngtAccDesignation,GENCashMngtAccDesignation,Complex Sentence,Medium,Multiple clauses,"This account will be in the name of your business. Please confirm if you require an additional designation or reference e.g. Office account, Collections account, Rental account?",Rental account?,,
ROW:2|KEY:GENCashMngtAccPurpose,GENCashMngtAccPurpose,Complex Sentence,Medium,Multiple clauses,"Please advise what the account is to be used for. For example, a combination of the following: payments of professional fees, dividend receipts/payments, rental income, expenses, trading income, purchases of wholesale goods, cash elements of an investment portfolio.",Please advise what the account is to be used for. For example,,
ROW:2|KEY:GENCashMngtAccStatFreq,GENCashMngtAccStatFreq,Complex Sentence,Medium,Multiple clauses,"Statements will be set on an annual default frequency. Should you require these more frequently, please indicate here:",Statements will be set on an annual default frequency. Should you require these more frequently,,
ROW:2|KEY:GENCurrentAccDesignation,GENCurrentAccDesignation,Complex Sentence,Medium,Multiple clauses,"This account will be in the name of your business. Please confirm if you require an additional designation or reference e.g. Office account, Collections account, Rental account?",Rental account?,,
ROW:2|KEY:GENCurrentAccPurpose,GENCurrentAccPurpose,Complex Sentence,Medium,Multiple clauses,"Please advise what the account is to be used for. For example, a combination of the following: payments of professional fees, dividend receipts/payments, rental income, expenses, trading income, purchases of wholesale goods, cash elements of an investment portfolio.",Please advise what the account is to be used for. For example,,
ROW:2|KEY:GENCurrentAccStatFreq,GENCurrentAccStatFreq,Complex Sentence,Medium,Multiple clauses,"Statements will be set on an annual default frequency. Should you require these more frequently, please indicate here:",Statements will be set on an annual default frequency. Should you require these more frequently,,
ROW:2|KEY:If_you_require_cheque_or_payingin_books_please_request_this_through_your_usual_contact_at_the_bank_once_you_have_received_your_account_number,If_you_require_cheque_or_payingin_books_please_request_this_through_your_usual_contact_at_the_bank_once_you_have_received_your_account_number,Complex Sentence,Medium,Multiple clauses,"If you require cheque or paying-in books, please request this through your usual contact at the bank, once you have received your account number.",If you require cheque or paying-in books,,
ROW:2|KEY:GENintermediarymandate,GENintermediarymandate,Complex Sentence,Medium,Multiple clauses,"Do you require your standard intermediary signatory list to apply to this account, i.e. no other signatories are to be appointed?",Do you require your standard intermediary signatory list to apply to this account,,
ROW:2|KEY:This_section_applies_if_the_intermediary_already_has_electronic_banking_If_not_please_speak_to_your_usual_contact_at_the_Bank_for_further_information,This_section_applies_if_the_intermediary_already_has_electronic_banking_If_not_please_speak_to_your_usual_contact_at_the_Bank_for_further_information,Complex Sentence,Medium,Multiple clauses,"This section applies if the intermediary already has electronic banking. If not, please speak to your usual contact at the Bank for further information.",This section applies if the intermediary already has electronic banking. If not,,
ROW:2|KEY:When_adding_Key_Principals_to_the_structure_please_link_all_directors_shareholders_partners_and_corporate_entities_connected_to_the_businessorganisation_which_may_include_General_Partner_Corporate_Director_Company_Secretary_Beneficial_ownersControlling_persons_etc_For_Limited_Liability_Partnerships_please_identify_all_Managing_Partners_if_corporate_entities_include_their_ownership_For_Limited_Partnerships_please_identify_all_General_Partners_if_corporate_entities_include_their_ownership_and_also_provide_details_of_the_Directors_and_Company_Secretary_of_the_General_Partners_if_a_company_or_MembersPartners_if_a_Limited_Liability_Partnership_For_trusts_please_include_all_named_parties_to_the_trust_if_corporate_entities_include_their_ownership_Please_include_all_individualslegal_entityies_that_have_a_controlling_or_material_interest_in_the_organisationbusiness_Please_ensure_that_details_are_provided_for_every_individuallegal_entity_who_directly_or_indirectly_owns_or_controls_25_or_more_of_the_businessorganisation_and_those_that_hold_a_material_interest_for_High_Risk_applications_this_would_be_10_or_more_Refer_to_glossary_contained_in_wwwrbsinternationalcomtaxresidency_for_definition_on_Controlling_person_Material_Interest_is_defined_as_those_beneficial_ownerscontrolling_persons_who_may_have_effective_control_over_the_capital_or_assets_whilst_not_holding_a_significant_percentage_ownership_In_all_instances_full_ownership_and_control_structure_needs_to_be_keyed_or_your_application_might_be_rejected_and_you_will_be_required_to_apply_again,When_adding_Key_Principals_to_the_structure_please_link_all_directors_shareholders_partners_and_corporate_entities_connected_to_the_businessorganisation_which_may_include_General_Partner_Corporate_Director_Company_Secretary_Beneficial_ownersControlling_persons_etc_For_Limited_Liability_Partnerships_please_identify_all_Managing_Partners_if_corporate_entities_include_their_ownership_For_Limited_Partnerships_please_identify_all_General_Partners_if_corporate_entities_include_their_ownership_and_also_provide_details_of_the_Directors_and_Company_Secretary_of_the_General_Partners_if_a_company_or_MembersPartners_if_a_Limited_Liability_Partnership_For_trusts_please_include_all_named_parties_to_the_trust_if_corporate_entities_include_their_ownership_Please_include_all_individualslegal_entityies_that_have_a_controlling_or_material_interest_in_the_organisationbusiness_Please_ensure_that_details_are_provided_for_every_individuallegal_entity_who_directly_or_indirectly_owns_or_controls_25_or_more_of_the_businessorganisation_and_those_that_hold_a_material_interest_for_High_Risk_applications_this_would_be_10_or_more_Refer_to_glossary_contained_in_wwwrbsinternationalcomtaxresidency_for_definition_on_Controlling_person_Material_Interest_is_defined_as_those_beneficial_ownerscontrolling_persons_who_may_have_effective_control_over_the_capital_or_assets_whilst_not_holding_a_significant_percentage_ownership_In_all_instances_full_ownership_and_control_structure_needs_to_be_keyed_or_your_application_might_be_rejected_and_you_will_be_required_to_apply_again,Complex Sentence,Medium,Multiple clauses,"When adding Key Principals to the structure, please link all directors, shareholders, partners and corporate entities connected to the business/organisation which may include General Partner, Corporate Director, Company Secretary, Beneficial owners/Controlling persons* etc.

For Limited Liability Partnerships, please identify all Managing Partners (if corporate entities include their ownership).

For Limited Partnerships, please identify all General Partners (if corporate entities include their ownership), and also provide details of the Directors and Company Secretary of the General Partner/s (if a company) or Members/Partners (if a Limited Liability Partnership).

For trusts, please include all named parties to the trust (if corporate entities include their ownership).

Please include all individual(s)/legal entity(ies) that have a controlling or material interest** in the organisation/business. Please ensure that details are provided for every individual/legal entity who directly or indirectly owns or controls 25% or more of the business/organisation and those that hold a material interest. (for High Risk applications this would be 10% or more)

*Refer to glossary contained in www.rbsinternational.com/taxresidency for definition on Controlling person.

**Material Interest is defined as those beneficial owners/controlling persons who may have effective control over the capital or assets whilst not holding a significant percentage ownership.

In all instances full ownership and control structure needs to be keyed or your application might be rejected and you will be required to apply again.",When adding Key Principals to the structure,,
ROW:2|KEY:As_the_application_does_not_meet_the_acceptable_definition_of_a_Wholesale_Depositor_this_application_must_be_referred_to_the_Relationship_Director,As_the_application_does_not_meet_the_acceptable_definition_of_a_Wholesale_Depositor_this_application_must_be_referred_to_the_Relationship_Director,Complex Sentence,Medium,Multiple clauses,"As the application does not meet the acceptable definition of a Wholesale Depositor, this application must be referred to the Relationship Director",As the application does not meet the acceptable definition of a Wholesale Depositor,,
